{
    "$schema": "../../schema/member.schema.json",
    "id": "ranolp",
    "display_name": "Ranolâ˜†P",
    "bio": "Lazy, but get Better.",
    "profile_image_url": "https://gravatar.com/avatar/8ef181fc6a8aaefd5e285af21a159c52.png?s=512",
    "gravatar_email": "public.ranolp@gmail.com",
    "baekjoon_id": "asdhugh1",
    "webpage_url": "https://twitter.com/RanolP_777",
    "github_id": "RanolP",
    "codeforces_id": "RanolP",
    "codeup_id": "asdhugh1"
}